<?xml version="1.0" encoding="UTF-8"?>
<tns:user xmlns:tns="http://www.example.org/TisseoVelib" xmlns:xsi="http://www.w3.org/2001/XMLSchema-instance" xsi:schemaLocation="http://www.example.org/TisseoVelib TisseoVelib.xsd ">
  <tns:id>0</tns:id>
  <tns:firstName>tns:firstName</tns:firstName>
  <tns:lastName>tns:lastName</tns:lastName>
  <tns:mail>tns:mail</tns:mail>
  <tns:adress>tns:adress</tns:adress>
  <tns:coordonnees>
    <tns:longitude>0.0</tns:longitude>
    <tns:latitude>0.0</tns:latitude>
  </tns:coordonnees>
</tns:user>
